{
  "format_version": "1.0",
  "kind": "canon",
  "name": "zhuifang",
  "display_name": "少女前线2：追放 canon 包",
  "language": "zh",
  "version": "0.2.0",
  "created": "2026-10-06",
  "updated": "2026-10-07",
  "cast_policy": {
    "min_active_canon_chars_per_volume": 3,
    "require_interface_for_oc": true,
    "ooc_ref": "characters.json",
    "note": "项目可在钉扎时放宽人数下限（cast_policy 可覆盖）；ban 词与 OOC 红线不可放宽"
  },
  "provenance": [],
  "license_note": "非官方同人创作辅助档案，仅收设定摘要与自写概括，不收原文段落；《少女前线》系列版权归原权利方（散爆网络 / MICA Team）所有。",
  "changelog": [
    "0.1.0 (2026-10-06): 首版——术语三级表、闪电小队 roster、时代锚点、污染分级、题材惯例；艾莫号前身两源冲突未裁决，列待核",
    "0.2.0 (2026-10-07): 四路联网核查+仲裁终审——艾莫号前身定稿格里芬资产说（医疗舰说判定为百科不实内容）；黛烟/弗必安/委托人存在性清账；寇尔芙与闪电小队五人 OOC 红线定稿（附证据强度与寇尔芙声线迁移约定）；新增 ban：抗辐剂/信用点/污染区字母分区；conventions 增晶条计价纪律"
  ]
}
